{
  "schema_version": "1.1.0",
  "audit_id": "audit-focused-literature-20260812",
  "scope": "original_research_paper",
  "status": "COMPLETE",
  "systematic_review_required": false,
  "database_accounts_required": false,
  "method": "focused-primary-source-audit-complete",
  "zotero_export": {
    "path": "references/zotero/export/library.bib",
    "sha256": "62099566F10E98EDBABFD670A51BDC71E4C2F9AF59E3AC563EA640870B6F7416"
  },
  "literature_review_note": {
    "path": "research/obsidian/03_Literature/literature-review.md",
    "sha256": "FDE072E4B9E0C0B0E0874D17440C1B10B3B326E368A42F71FA53BF6A848556C7"
  },
  "literature_synthesis_note": {
    "path": "research/obsidian/03_Literature/literature-synthesis.md",
    "sha256": "0C10DBC206DC841D27D0EDD06DC3F85A0216CC0CCE2136E10DC5E39501873795"
  },
  "nearest_work_matrix": {
    "path": "research/obsidian/03_Literature/nearest-work-matrix.md",
      "sha256": "56F0775538F833EC49F40DC39F258425AEEF27CA0D2D38D1F07F2CE66C769D4E"
  },
  "research_gap_note": {
    "path": "research/obsidian/04_Research_Gap/research-gap.md",
      "sha256": "C8FAA80F492AA05A89E76335D0C0EF26BD14442CE25BC481934259400D2557C4"
  },
  "source_notes": [
    {
      "path": "research/obsidian/03_Literature/Sources/source-samavi-sicnav-2026.md",
      "sha256": "993EDFED304BE7097362BC721EED6513FE299A4F9828ACBEF537D762D64942A2"
    },
    {
      "path": "research/obsidian/03_Literature/Sources/source-cooperative-gp-mpc-2026.md",
      "sha256": "F697EFD750D237E2220F7C4BBCDA111A6CA8A1B44A7541A053B6038598F0289F"
    },
    {
      "path": "research/obsidian/03_Literature/Sources/source-dra-mppi-2025.md",
      "sha256": "B70E7149A357A9AA31231223F3872BB07D3E6EA4AB1345382792C95E7479199B"
    },
    {
      "path": "research/obsidian/03_Literature/Sources/source-bonzanini-pac-mpc.md",
      "sha256": "5EECC2E00B40B9D3183F32C0382AEB7B11030D75EAED7638166BC4650B17AA32"
    },
    {
      "path": "research/obsidian/03_Literature/Sources/source-dai-pchekov.md",
      "sha256": "08AE26C5E54BE2EF4FE2D9A413E07CF44D185E3FC9314B6E781B1D349F5542D8"
    },
    {
      "path": "research/obsidian/03_Literature/Sources/source-engelaar-elastic-risk.md",
      "sha256": "D2E6692B08C82B24F52B4D3FBFC9C30925D9AA6D8F0E0ADFBA29C563EC992A69"
    },
    {
      "path": "research/obsidian/03_Literature/Sources/source-huang-bayesian-lstm.md",
      "sha256": "4A18C6B9D4587CABB307B83A39CD49322B58E28DCEA58EEEA03227EC1ECFD27E"
    },
    {
      "path": "research/obsidian/03_Literature/Sources/source-liu-arms-mpc.md",
      "sha256": "13E1B6B0470CC4B0867EFBB599A5B8430F5FEA776A8D8017D5BB9DD7752428E0"
    },
    {
      "path": "research/obsidian/03_Literature/Sources/source-ren-feasibility.md",
      "sha256": "C3469BBDDC87B1A3933EC469C0C79AF3B106C1B0199301105ED85A79F46158C2"
    },
    {
      "path": "research/obsidian/03_Literature/Sources/source-ren-multimodal-risk.md",
      "sha256": "96DB5E4FC380D5AC92E4C1CF23208849205E90C351308FADDC5ED5EFF42F1434"
    },
    {
      "path": "research/obsidian/03_Literature/Sources/source-zhang-chance-mpc.md",
      "sha256": "18212B5BC8B78790F6ADA9F826DAABD0189149C5FE18598260323A679617C1AA"
    },
    {
      "path": "research/obsidian/03_Literature/web-verified-gap-sources.md",
      "sha256": "78D0F9354BE1C437D497B0BC84A5F605B673715ABBB028B37D6DC9A504000AB7"
    },
    {
      "path": "research/obsidian/03_Literature/Sources/source-dyakov-mecanum-dynamics.md",
      "sha256": "F5AABCEE0BC478967E9DDCC0146A6E7F587D577FD88632FC93CED0E6BABC2F1B"
    },
    {
      "path": "research/obsidian/03_Literature/Sources/source-trepella-sfm-nmpc-2026.md",
      "sha256": "D699B392C82AB717DE4FBC28EC4DF386C82F014858769971241AF320A3163F34"
    },
    {
      "path": "research/obsidian/03_Literature/Sources/source-crowd-mpc-multisensor-2026.md",
      "sha256": "88C8C25C65E692177F0CAC1EED466FDA293C4E6C146BCDBAB8BBF4149CA0C5DD"
    },
    {
      "path": "research/obsidian/03_Literature/Sources/source-humain-implicit-social-2026.md",
      "sha256": "DEE4A214C423728289A9EA41D8F58960F645597FA1312E41C19ED9928D45F099"
    },
    {
      "path": "research/obsidian/03_Literature/Sources/source-stratton-hmp-navigation-2026.md",
      "sha256": "2E5A04C76AF4D3EFD0E0229AAA8DF45180D62ECB6A9B1527AB511325CA94C406"
    },
    {
      "path": "research/obsidian/03_Literature/Sources/source-alfayizi-mecanum-2026.md",
      "sha256": "95872F68F94E5304A6DF62AFEBDCD3EF0269DA142B2A96C3BD7A1B2659BECB26"
    },
    {
      "path": "research/obsidian/03_Literature/Sources/source-ultralytics-yolo26-pose.md",
      "sha256": "DA26EE94523206293DF8E1095D0FD95C47A6793ADDDFC231461E2F97EC1C7ED3"
    },
    {
      "path": "research/obsidian/03_Literature/Sources/source-chen-lstm-td3-2026.md",
      "sha256": "9012C8A4D7A07BD6677FAD151BA986820B50FE3DF172F2DC98EB540614B980AA"
    },
    {
      "path": "research/obsidian/03_Literature/Sources/source-gravina-crowd-mpc-2026.md",
      "sha256": "EDEA8CB52C94AE6D206EA9BC9F351761D4388203B097BF0A9B64E0F8C228C6C2"
    },
    {
      "path": "research/obsidian/03_Literature/Sources/source-luna-mecanum-unknown-input-2026.md",
      "sha256": "5C11C957D8FA66A95C16B40A6ABFD636981161090997182AC8A14777F118A549"
    },
    {
      "path": "research/obsidian/03_Literature/Sources/source-ye-scu-t-mpc-2026.md",
      "sha256": "3026D82FF87F07A4A19C32C1E31369B44957BAE6816D0FEB6FEEECB2B952B966"
    },
    {
      "path": "research/obsidian/03_Literature/Sources/source-pham-mecanum-hybrid-2026.md",
      "sha256": "095A950ADB8FE4A9630DFA2ECDA5BCA124F0BBF172C397BF697772C43141BF8B"
    },
    {
      "path": "research/obsidian/03_Literature/Sources/source-collaborative-emergency-protection-2026.md",
      "sha256": "57AF658517B90CAF3117A093B81668260480C752988D2B637B16B8D5D6842225"
    },
    {
      "path": "research/obsidian/03_Literature/Sources/source-unified-risk-map-2026.md",
      "sha256": "14C4613F2DA4B418B40401B51E8DCAD7E25DADD96E2DC5C2CD016D965BE37B67"
    },
    {
      "path": "research/obsidian/03_Literature/Sources/source-integrated-estimation-nmpc-2026.md",
      "sha256": "46A77E7CE6AD0BC12368AD356250AA41DC1B5F4C5AA9C8CDA0E19BE57FC52B04"
    },
    {
      "path": "research/obsidian/03_Literature/Sources/source-stefanini-context-aware-mpc-2024.md",
      "sha256": "DC1E7389F096BE5721F94224F2427A6EED75AF508ADA1D76EC8FC6C1A9607B00"
    },
    {
      "path": "research/obsidian/03_Literature/Sources/source-position-state-boundary-20260813.md",
      "sha256": "D959708D5501B2C455BC7C809BF22731E74D2BF79573ABBE72FCFFAFB0F81B40"
    },
    {
      "path": "research/obsidian/03_Literature/Sources/source-tadano-pedestrian-attention-2025.md",
      "sha256": "33C090FC43F2C8700C2B7EA20D3EFD807AB2EB0E7D4958812E6712A42E9CB036"
    },
    {
      "path": "research/obsidian/03_Literature/Sources/source-agrawal-rpi-dataset-2025.md",
      "sha256": "6FAB6A20B893E75A4C2B9C344E1CCD799C71517096D4009ABEF9B4205F43685C"
    },
    {
      "path": "research/obsidian/03_Literature/Sources/source-social-navigation-refresh-20260814.md",
      "sha256": "E90A893B500D495A85CC681F253D2C232699B0D32317C5348AF61BE405D21B03"
    }
  ],
  "reviewer_id": "researcher-01",
  "reviewed_at": "2026-08-14T00:00:00Z",